{
  "$schema": "https://blenx-ui.vercel.app/docs/docs-meta.schema.json",
  "title": "Avatar",
  "description": "An avatar component with image and fallback support. Displays a user profile image or initials placeholder.",
  "category": "Data Display",
  "status": "stable",
  "keywords": ["avatar", "profile", "image", "user", "fallback"],
  "related": ["Badge"]
}
