{
  "$schema": "https://blenx-ui.vercel.app/docs/docs-meta.schema.json",
  "title": "Menu",
  "description": "A dropdown menu with items, separators, group labels, and shortcuts. Built on Base UI Menu.",
  "category": "Navigation",
  "status": "stable",
  "keywords": ["menu", "dropdown", "context menu", "navigation"],
  "related": ["Button"],
  "accessibility": {
    "keyboard": ["ArrowUp", "ArrowDown", "Enter", "Escape"],
    "aria": ["role", "aria-orientation"]
  }
}
