{
	"title": "Surface",
	"description": "A background surface layer with variant presets for different visual depths. Supports interactive hover styles.",
	"category": "Layout",
	"status": "stable",
	"keywords": ["surface", "background", "container", "elevation", "card"],
	"related": ["Box", "Card"]
}
