{
	"$schema": "https://blenx-ui.vercel.app/docs/docs-meta.schema.json",
	"title": "Stack",
	"description": "A flexbox layout component with gap, alignment, and direction control. Includes VStack and HStack shorthands.",
	"category": "Layout",
	"status": "stable",
	"keywords": ["stack", "flex", "layout", "vstack", "hstack", "flexbox"],
	"related": ["Box", "Grid"]
}
