{
	"$schema": "../../../schemas/docs-meta.schema.json",
	"title": "Combobox",
	"description": "A combobox with single and multi-select (chip) support, built on Base UI Combobox with filtering and popup.",
	"category": "Forms",
	"status": "stable",
	"keywords": ["combobox", "select", "autocomplete", "chips", "multi-select"],
	"related": ["Input", "ScrollArea", "Field", "Autocomplete"]
}
