{
  "$schema": "https://blenx-ui.vercel.app/docs/docs-meta.schema.json",
  "title": "Spinner",
  "description": "A loading spinner with ARIA role and label for accessible loading state indication.",
  "category": "Feedback",
  "status": "stable",
  "keywords": ["spinner", "loading", "loader", "progress", "wait"],
  "related": ["Button", "Progress"],
  "accessibility": {
    "aria": ["role", "aria-label"]
  }
}
